{
 "format": "cnc-parts",
 "version": 1,
 "project": "exemple",
 "unit": "mm",
 "parts": [
  {
   "id": "CX-01",
   "category": "Couvre-joint",
   "qty": 6,
   "thickness": 3,
   "outer": [
    [
     0,
     0
    ],
    [
     56,
     0
    ],
    [
     56,
     50
    ],
    [
     0,
     50
    ]
   ],
   "holes": [
    [
     [
      10,
      15
     ],
     [
      13,
      15
     ],
     [
      13,
      35
     ],
     [
      10,
      35
     ]
    ],
    [
     [
      43,
      15
     ],
     [
      46,
      15
     ],
     [
      46,
      35
     ],
     [
      43,
      35
     ]
    ]
   ]
  },
  {
   "id": "CX-02",
   "category": "Couvre-joint",
   "qty": 4,
   "thickness": 3,
   "outer": [
    [
     0,
     0
    ],
    [
     120,
     0
    ],
    [
     120,
     50
    ],
    [
     0,
     50
    ]
   ]
  },
  {
   "id": "N-01",
   "category": "Nervure",
   "qty": 8,
   "thickness": 3,
   "outer": [
    [
     0,
     0
    ],
    [
     56,
     0
    ],
    [
     56,
     56
    ],
    [
     0,
     56
    ]
   ],
   "holes": [
    [
     [
      34,
      28
     ],
     [
      33.885,
      29.171
     ],
     [
      33.543,
      30.296
     ],
     [
      32.989,
      31.333
     ],
     [
      32.243,
      32.243
     ],
     [
      31.333,
      32.989
     ],
     [
      30.296,
      33.543
     ],
     [
      29.171,
      33.885
     ],
     [
      28,
      34
     ],
     [
      26.829,
      33.885
     ],
     [
      25.704,
      33.543
     ],
     [
      24.667,
      32.989
     ],
     [
      23.757,
      32.243
     ],
     [
      23.011,
      31.333
     ],
     [
      22.457,
      30.296
     ],
     [
      22.115,
      29.171
     ],
     [
      22,
      28
     ],
     [
      22.115,
      26.829
     ],
     [
      22.457,
      25.704
     ],
     [
      23.011,
      24.667
     ],
     [
      23.757,
      23.757
     ],
     [
      24.667,
      23.011
     ],
     [
      25.704,
      22.457
     ],
     [
      26.829,
      22.115
     ],
     [
      28,
      22
     ],
     [
      29.171,
      22.115
     ],
     [
      30.296,
      22.457
     ],
     [
      31.333,
      23.011
     ],
     [
      32.243,
      23.757
     ],
     [
      32.989,
      24.667
     ],
     [
      33.543,
      25.704
     ],
     [
      33.885,
      26.829
     ]
    ]
   ]
  },
  {
   "id": "N-02",
   "category": "Nervure",
   "qty": 2,
   "thickness": 3,
   "outer": [
    [
     0,
     0
    ],
    [
     100,
     0
    ],
    [
     100,
     100
    ],
    [
     0,
     100
    ]
   ],
   "holes": [
    [
     [
      20,
      20
     ],
     [
      80,
      20
     ],
     [
      80,
      80
     ],
     [
      20,
      80
     ]
    ]
   ]
  },
  {
   "id": "L-01",
   "category": "Équerre",
   "qty": 3,
   "thickness": 3,
   "outer": [
    [
     0,
     0
    ],
    [
     60,
     0
    ],
    [
     60,
     20
    ],
    [
     20,
     20
    ],
    [
     20,
     50
    ],
    [
     0,
     50
    ]
   ]
  },
  {
   "id": "R-01",
   "category": "Rondelle",
   "qty": 4,
   "thickness": 3,
   "outer": [
    [
     40,
     20
    ],
    [
     39.829,
     22.611
    ],
    [
     39.319,
     25.176
    ],
    [
     38.478,
     27.654
    ],
    [
     37.321,
     30
    ],
    [
     35.867,
     32.175
    ],
    [
     34.142,
     34.142
    ],
    [
     32.175,
     35.867
    ],
    [
     30,
     37.321
    ],
    [
     27.654,
     38.478
    ],
    [
     25.176,
     39.319
    ],
    [
     22.611,
     39.829
    ],
    [
     20,
     40
    ],
    [
     17.389,
     39.829
    ],
    [
     14.824,
     39.319
    ],
    [
     12.346,
     38.478
    ],
    [
     10,
     37.321
    ],
    [
     7.825,
     35.867
    ],
    [
     5.858,
     34.142
    ],
    [
     4.133,
     32.175
    ],
    [
     2.679,
     30
    ],
    [
     1.522,
     27.654
    ],
    [
     0.681,
     25.176
    ],
    [
     0.171,
     22.611
    ],
    [
     0,
     20
    ],
    [
     0.171,
     17.389
    ],
    [
     0.681,
     14.824
    ],
    [
     1.522,
     12.346
    ],
    [
     2.679,
     10
    ],
    [
     4.133,
     7.825
    ],
    [
     5.858,
     5.858
    ],
    [
     7.825,
     4.133
    ],
    [
     10,
     2.679
    ],
    [
     12.346,
     1.522
    ],
    [
     14.824,
     0.681
    ],
    [
     17.389,
     0.171
    ],
    [
     20,
     0
    ],
    [
     22.611,
     0.171
    ],
    [
     25.176,
     0.681
    ],
    [
     27.654,
     1.522
    ],
    [
     30,
     2.679
    ],
    [
     32.175,
     4.133
    ],
    [
     34.142,
     5.858
    ],
    [
     35.867,
     7.825
    ],
    [
     37.321,
     10
    ],
    [
     38.478,
     12.346
    ],
    [
     39.319,
     14.824
    ],
    [
     39.829,
     17.389
    ]
   ],
   "holes": [
    [
     [
      25,
      20
     ],
     [
      24.904,
      20.975
     ],
     [
      24.619,
      21.913
     ],
     [
      24.157,
      22.778
     ],
     [
      23.536,
      23.536
     ],
     [
      22.778,
      24.157
     ],
     [
      21.913,
      24.619
     ],
     [
      20.975,
      24.904
     ],
     [
      20,
      25
     ],
     [
      19.025,
      24.904
     ],
     [
      18.087,
      24.619
     ],
     [
      17.222,
      24.157
     ],
     [
      16.464,
      23.536
     ],
     [
      15.843,
      22.778
     ],
     [
      15.381,
      21.913
     ],
     [
      15.096,
      20.975
     ],
     [
      15,
      20
     ],
     [
      15.096,
      19.025
     ],
     [
      15.381,
      18.087
     ],
     [
      15.843,
      17.222
     ],
     [
      16.464,
      16.464
     ],
     [
      17.222,
      15.843
     ],
     [
      18.087,
      15.381
     ],
     [
      19.025,
      15.096
     ],
     [
      20,
      15
     ],
     [
      20.975,
      15.096
     ],
     [
      21.913,
      15.381
     ],
     [
      22.778,
      15.843
     ],
     [
      23.536,
      16.464
     ],
     [
      24.157,
      17.222
     ],
     [
      24.619,
      18.087
     ],
     [
      24.904,
      19.025
     ]
    ]
   ]
  },
  {
   "id": "F-01",
   "category": "Fond",
   "qty": 1,
   "thickness": 5,
   "rotate": "none",
   "outer": [
    [
     0,
     0
    ],
    [
     196,
     0
    ],
    [
     196,
     196
    ],
    [
     0,
     196
    ]
   ],
   "holes": [
    [
     [
      123,
      98
     ],
     [
      122.786,
      101.263
     ],
     [
      122.148,
      104.47
     ],
     [
      121.097,
      107.567
     ],
     [
      119.651,
      110.5
     ],
     [
      117.834,
      113.219
     ],
     [
      115.678,
      115.678
     ],
     [
      113.219,
      117.834
     ],
     [
      110.5,
      119.651
     ],
     [
      107.567,
      121.097
     ],
     [
      104.47,
      122.148
     ],
     [
      101.263,
      122.786
     ],
     [
      98,
      123
     ],
     [
      94.737,
      122.786
     ],
     [
      91.53,
      122.148
     ],
     [
      88.433,
      121.097
     ],
     [
      85.5,
      119.651
     ],
     [
      82.781,
      117.834
     ],
     [
      80.322,
      115.678
     ],
     [
      78.166,
      113.219
     ],
     [
      76.349,
      110.5
     ],
     [
      74.903,
      107.567
     ],
     [
      73.852,
      104.47
     ],
     [
      73.214,
      101.263
     ],
     [
      73,
      98
     ],
     [
      73.214,
      94.737
     ],
     [
      73.852,
      91.53
     ],
     [
      74.903,
      88.433
     ],
     [
      76.349,
      85.5
     ],
     [
      78.166,
      82.781
     ],
     [
      80.322,
      80.322
     ],
     [
      82.781,
      78.166
     ],
     [
      85.5,
      76.349
     ],
     [
      88.433,
      74.903
     ],
     [
      91.53,
      73.852
     ],
     [
      94.737,
      73.214
     ],
     [
      98,
      73
     ],
     [
      101.263,
      73.214
     ],
     [
      104.47,
      73.852
     ],
     [
      107.567,
      74.903
     ],
     [
      110.5,
      76.349
     ],
     [
      113.219,
      78.166
     ],
     [
      115.678,
      80.322
     ],
     [
      117.834,
      82.781
     ],
     [
      119.651,
      85.5
     ],
     [
      121.097,
      88.433
     ],
     [
      122.148,
      91.53
     ],
     [
      122.786,
      94.737
     ]
    ]
   ]
  },
  {
   "id": "P-01",
   "category": "Paroi",
   "qty": 4,
   "thickness": 5,
   "outer": [
    [
     0,
     0
    ],
    [
     196,
     0
    ],
    [
     196,
     57
    ],
    [
     0,
     57
    ]
   ]
  }
 ]
}